[
  {
    "is_synthetic": true,
    "id": "RMAREQ-0091",
    "ticket_id": "WO-0091",
    "status": "draft_pending_documents",
    "decision": null,
    "approved_by": null,
    "notice": "仅演示申请草稿，不能把收到申请当作同意退换或赔付。"
  },
  {
    "is_synthetic": true,
    "id": "RMAREQ-0094",
    "ticket_id": "WO-0094",
    "status": "draft_pending_documents",
    "decision": null,
    "approved_by": null,
    "notice": "仅演示申请草稿，不能把收到申请当作同意退换或赔付。"
  },
  {
    "is_synthetic": true,
    "id": "RMAREQ-0097",
    "ticket_id": "WO-0097",
    "status": "draft_pending_documents",
    "decision": null,
    "approved_by": null,
    "notice": "仅演示申请草稿，不能把收到申请当作同意退换或赔付。"
  },
  {
    "is_synthetic": true,
    "id": "RMAREQ-0100",
    "ticket_id": "WO-0100",
    "status": "draft_pending_documents",
    "decision": null,
    "approved_by": null,
    "notice": "仅演示申请草稿，不能把收到申请当作同意退换或赔付。"
  },
  {
    "is_synthetic": true,
    "id": "RMAREQ-0421",
    "ticket_id": "WO-0421",
    "status": "draft_pending_documents",
    "decision": null,
    "approved_by": null,
    "notice": "仅演示申请草稿，不能把收到申请当作同意退换或赔付。"
  },
  {
    "is_synthetic": true,
    "id": "RMAREQ-0424",
    "ticket_id": "WO-0424",
    "status": "draft_pending_documents",
    "decision": null,
    "approved_by": null,
    "notice": "仅演示申请草稿，不能把收到申请当作同意退换或赔付。"
  },
  {
    "is_synthetic": true,
    "id": "RMAREQ-0427",
    "ticket_id": "WO-0427",
    "status": "draft_pending_documents",
    "decision": null,
    "approved_by": null,
    "notice": "仅演示申请草稿，不能把收到申请当作同意退换或赔付。"
  },
  {
    "is_synthetic": true,
    "id": "RMAREQ-0430",
    "ticket_id": "WO-0430",
    "status": "draft_pending_documents",
    "decision": null,
    "approved_by": null,
    "notice": "仅演示申请草稿，不能把收到申请当作同意退换或赔付。"
  },
  {
    "is_synthetic": true,
    "id": "RMAREQ-0441",
    "ticket_id": "WO-0441",
    "status": "draft_pending_documents",
    "decision": null,
    "approved_by": null,
    "notice": "仅演示申请草稿，不能把收到申请当作同意退换或赔付。"
  },
  {
    "is_synthetic": true,
    "id": "RMAREQ-0444",
    "ticket_id": "WO-0444",
    "status": "draft_pending_documents",
    "decision": null,
    "approved_by": null,
    "notice": "仅演示申请草稿，不能把收到申请当作同意退换或赔付。"
  },
  {
    "is_synthetic": true,
    "id": "RMAREQ-0447",
    "ticket_id": "WO-0447",
    "status": "draft_pending_documents",
    "decision": null,
    "approved_by": null,
    "notice": "仅演示申请草稿，不能把收到申请当作同意退换或赔付。"
  },
  {
    "is_synthetic": true,
    "id": "RMAREQ-0450",
    "ticket_id": "WO-0450",
    "status": "draft_pending_documents",
    "decision": null,
    "approved_by": null,
    "notice": "仅演示申请草稿，不能把收到申请当作同意退换或赔付。"
  }
]
